{
  "courtFormId": "<COURT_FORM_ID>",
  "caseId": "<CASE_ID>",
  "formId": "<FORM_ID>",
  "formType": "BCM",
  "formDefendants": [
    {
      "defendantId": "<DEFENDANT_ID>"
    }
  ],
  "formData": "{\"id\":\"ID\",\"formId\":\"FORM_ID\",\"caseId\":\"CASE_ID\",\"defendants\":[{\"defendantId\":\"DEFENDANT_ID\",\"offences\":[\"123\",\"321\"]},{\"defendantId\":\"abc\",\"offences\":[\"abc\",\"xyz\"]}],\"data\":{\"prosecution\":{\"witnesses\":[{\"id\":\"qwe\",\"name\":\"BillROGERS\",\"age\":\"01/01/1950\",\"InterpreterRequired\":true,\"defenceDynamicFormAnswers\":{\"witnessGroup\":{\"crossExam\":\"Yes\"}},\"prosecutionDynamicFormAnswers\":{\"witnessGroup\":{\"specialMeasures\":\"Yes\",\"specialMeasuresYesGroup\":{\"specialMeasuresDetail\":\"Achair\"}}}},{\"id\":\"123\",\"caseWitnessId\":\"hgf\",\"defenceDynamicFormAnswers\":{\"witnessGroup\":{\"crossExam\":\"Yes\"}},\"prosecutionDynamicFormAnswers\":{\"witnessGroup\":{\"specialMeasures\":\"Yes\",\"specialMeasuresYesGroup\":{\"specialMeasuresDetail\":\"Achair\"}}}},{\"id\":\"321\",\"caseWitnessId\":\"tds\",\"defenceDynamicFormAnswers\":{\"witnessGroup\":{\"crossExam\":\"Yes\"}},\"prosecutionDynamicFormAnswers\":{\"witnessGroup\":{\"specialMeasures\":\"Yes\",\"specialMeasuresYesGroup\":{\"specialMeasuresDetail\":\"Achair\"}}}}],\"defenceDynamicFormAnswers\":{\"prosecutorGroup\":{\"prosecutorServeEvidence\":\"Yes\",\"prosecutorServeEvidenceYesGroup\":{\"prosecutorServeEvidenceDetails\":\"Servemoreevidenceinfo\"},\"prosecutionCompliance\":\"Yes\",\"prosecutionComplianceYesGroup\":{\"prosecutionComplianceDetailsYes\":\"Undisclosedinfo\"},\"prosecutionComplianceNoGroup\":{\"prosecutionComplianceDetailsNo\":\"\"},\"pendingLinesOfEnquiry\":\"Yes\",\"pendingLinesOfEnquiryYesGroup\":{\"pendingLinesOfEnquiryYesGroup\":\"Pendinginfo\"},\"slaveryOrExploitation\":\"Yes\",\"slaveryOrExploitationYesGroup\":{\"slaveryOrExploitationDetails\":\"Victiminfo\"},\"relyOn\":[\"admissions\",\"cctv\"],\"relyOnAdmissionsGroup\":{\"admissionsDetails\":\"admissioninfo\"},\"relyOnFailureGroup\":{\"failureDetails\":\"\"},\"displayEquipment\":\"Yes\",\"displayEquipmentYesGroup\":{\"displayEquipmentDetails\":\"Displayequipmentinfo\"},\"pointOfLaw\":\"Yes\",\"pointOfLawYesGroup\":{\"pointOfLawDetails\":\"Complexinfo\"}},\"applicationsForDirectionsGroup\":{\"prosecutorWitnessAssistance\":\"Yes\",\"prosecutorWitnessAssistanceYesGroup\":{\"witnessRequiresDetails\":\"\"},\"groundRulesQuestioning\":\"Yes\",\"variationStandardDirections\":\"Yes\",\"variationStandardDirectionsYesGroup\":{\"variationStandardDirectionsYesGroupDetails\":\"Standardtrialinfo\"}}}},\"defence\":{\"defendants\":[{\"id\":\"DEFENDANT_ID\",\"defenceDynamicFormAnswers\":{\"adviceOnPleaAndAbsenceGroup\":{\"creditForGuilty\":\"\",\"defendantUnderstand\":\"\"},\"PresenceGroup\":{\"defendantPresent\":\"Yes\",\"defendantPresentYesGroup\":{\"defendantPresentDetail\":\"Disputeinfo\"},\"defendantInvolvement\":\"Yes\",\"defendantInvolvementYesGroup\":{\"defendantInvolvementYesGroupDetail\":\"Involvementinfo\"},\"anticipatedDefence\":[\"irrelevant\"],\"slaveryOrExploitationGroup\":{\"slaveryOrExploitationGroupText\":\"\"}},\"directionsGroup\":{\"prosecutionWitnessRequires\":\"Yes\",\"prosecutionWitnessRequiresesGroup1\":{\"prosecutionWitnessRequiresesGroup1Details\":\"\"},\"whatAreTheIssues\":\"\",\"whatAreTheIssuesGroup\":{\"explainDispute\":\"Issuesainfo\",\"explainLaw\":\"Issuesbinfo\"}}}},{\"id\":\"abc\",\"dynamicFormData\":{\"adviceOnPleaAndAbsenceGroup\":{\"creditForGuilty\":\"\",\"defendantUnderstand\":\"\"},\"PresenceGroup\":{\"defendantPresent\":\"Yes\",\"defendantPresentYesGroup\":{\"defendantPresentDetail\":\"Disputeinfo\"},\"defendantInvolvement\":\"Yes\",\"defendantInvolvementYesGroup\":{\"defendantInvolvementYesGroupDetail\":\"Involvementinfo\"},\"anticipatedDefence\":[\"irrelevant\"],\"slaveryOrExploitationGroup\":{\"slaveryOrExploitationGroupText\":\"\"}},\"directionsGroup\":{\"prosecutionWitnessRequires\":\"Yes\",\"prosecutionWitnessRequiresesGroup1\":{\"prosecutionWitnessRequiresesGroup1Details\":\"\"},\"whatAreTheIssues\":\"\",\"whatAreTheIssuesGroup\":{\"explainDispute\":\"Issuesainfo\",\"explainLaw\":\"Issuesbinfo\"}}}}],\"witnesses\":[{\"caseWitnessId\":\"UUID\",\"FormProsecutionWitnessId\":\"UUID\",\"isDefendant\":true,\"name\":\"JohnSMITH\",\"age\":\"01/01/1980\",\"InterpreterRequired\":true,\"prosecutionDynamicFormAnswers\":{\"witnessGroup\":{\"crossExam\":\"Yes\"}},\"defenceDynamicFormAnswers\":{\"witnessGroup\":{\"specialMeasures\":\"Yes\",\"specialMeasuresYesGroup\":{\"specialMeasuresDetail\":\"Achair\"}}}},{\"caseWitnessId\":null,\"FormProsecutionWitnessId\":\"UUID\",\"isDefendant\":true,\"name\":\"JamesSAUNDERS\",\"age\":\"01/01/1970\",\"InterpreterRequired\":true,\"prosecutionDynamicFormAnswers\":{\"witnessGroup\":{\"crossExam\":\"Yes\"}},\"defenceDynamicFormAnswers\":{\"witnessGroup\":{\"specialMeasures\":\"Yes\",\"specialMeasuresYesGroup\":{\"specialMeasuresDetail\":\"Achair\"}}}}]}}}",
  "updatedBy": {
    "id" : "<USER_ID>",
    "firstName": "formCreatorFirstName",
    "lastName": "formCreatorLastName"
  }
}

